index,title,author,text,publisher,datepublished,link
44,Unavoidable consequences ,Jose Ma Montelibano,"I chose to write this article well before my weekly deadline. My mind is full of thoughts that I don’t want to let fade away once the current crisis is over. I recall September 25-26, 2009, when Typhoon Ondoy devastated Metro Manila and surrounding provinces, dumping a record amount of rain. Who could have imagined that Typhoon Carina would follow in Ondoy’s footsteps and even surpass it in rainfall?

Fifteen years ago, I was younger and more able to actively participate in Gawad Kalinga’s relief operations. What I witnessed was heart-wrenching. It wasn’t just the extent of the damage; it was who was affected and why. Typhoon Carina’s impact was no different—it was the poor who bore the brunt.

As always, there is widespread criticism of government inefficiency and possibly neglect. This pattern remains unchanged from 15 years ago. While there are now more details about the 5,500 flood control projects that were not there in 2009, the response remains similar. Government reactions, including Ferdinand Marcos Jr.’s focus on trash and climate change as primary causes, are superficial. The root causes are deeper and more complex, which is why the flooding in Metro Manila will persist beyond his term.

Trash is merely a consequence, not a root cause. It exacerbates other issues. While the poor communities along riverbanks are often blamed for the trash, we must ask a crucial question: Why are they there? Riverbanks, canals, seashores, and crevices are not suitable for habitation, yet millions of Filipinos have settled there. They only end up being displaced when natural or man-made disasters strike, such as fires in the slums. But they will return, as they have in the past. Some slums in Metro Manila have been there for 50 years or more.

The reason they are there is straightforward: they have nowhere else to go to survive. The next question is: Where did they come from?

Many are survivors of previous calamities in their home provinces, mainly in the Visayas and Bicol, which are frequently hit by typhoons. When storms, earthquakes, landslides, and floods devastate their communities, hunger drives them to seek work in cities and towns. They leave because they have no other option.

Thus, when discussing calamities, climate change, and trash, we must address poverty. We need to understand the impact of calamities on the poor and how hunger and despair force them to relocate.

Poverty, like flooding, damages lives and property. To address poverty, we must examine who is affected, why, where, and how. Poverty is a consequence of deeper issues, leading us to the root cause: corruption.

Corruption is an insatiable force that consumes everything in its path if given the chance. Addressing Metro Manila’s flooding also means tackling corruption and poverty, not just adapting to climate change.

Looking at corruption and poverty in the Philippines requires a brief historical perspective. In the past, when our population was small and land abundant, the datu system needed people to make land productive. People had real value, while land was less significant.

Colonial rule, however, introduced a greedy master. Colonizers, driven by the desire for loot and bounty, distributed land grants to favored individuals as rewards or in exchange for tribute. Since it was all agricultural then, tribute from people mostly meant what people could produce. Despite the abundance of land, people were all the more necessary for cultivation and tribute. People retained more value over land.

Modernity shifted these dynamics. Advances in science and technology, particularly in reducing infant mortality, led to a population boom. More people served the few elites, who maintained their power and wealth. The elite, both historically and currently, have exploited others. This exploitation, deeply rooted in history, continues to shape our society. And why the term elite still carries a pejorative nuance about it.

Development has followed a master-slave dynamic, making calamities disproportionately destructive to the poor. The zoning laws and their enforcement are suspect, to say the least. They produce comfort for some, luxury for a few, and almost inhuman conditions for most. The real estate developers do not plan for the poor, but the government must. And it never did with a sense of respect and dignity.

Knowing what we have known for decades from our own weather patterns, government and private developers never established clear and equitable zoning principles. Naturally, when the ratio between land and people allows density, even traffic flow is choked – all for money.

Despite the Philippines’ democratic ideals, historical and traditional patterns of superiority and entitlement persist. Until democracy evolves beyond these historical inequalities, the divide will remain, with only superficial gestures toward equality. And we can forget solving floods in a metropolis that continues to defy safety and social risks.

Democracy is not a gift but a challenge. It must be earned, and it requires sacrifice, even the possibility of death. Democracy can be a powerful shield against calamities, poverty, and corruption if it prioritizes the common good over elitism. Intervention towards a sick metropolis can correct extreme anomalies and guide future development to be more friendly to the majority.

The power of democracy lies in the hands of the people, if they choose to seize it. I do not see it coming soon, however, because the people, especially the poor, continue to endure their fate.",Inquirer,08/02/2024,https://opinion.inquirer.net/175652/unavoidable-consequences
45,Terrain and weather,Jose Ma Montelibano,"The Sona is over but the rains and floods are just starting. From a special report card day with a lot of clapping and cheering, it is back to the streets – and the streets are very wet.

I used to remember as a kid that we had longer rain months 70 years ago versus today. It’s either the La Niña phenomenon was occurring quite often then, or global warming has generally shortened the annual periods of rain. Because of that memory in the 50s and 60s, I am less worried about the frequent rains than I am with the longer hot months.

Pagasa today would describe our climate as 6 months wet and six months dry. This ratio is not at all when I remember, and not also how our climate was described decades before. Maybe Wikipedia has a better description that Pagasa, maybe because it can trace global climate records further back in time. Wikipedia claims we have three seasons instead of two, and I think I understand and accept why.

The three seasons are: a hot dry season from March to May, a rainy season from June to November, and a cool dry season from December to February. If I recall correctly, a powerful typhoon visited my hometown one early December in 1951 and devastated Bacolod City among other cities and towns in Central Visayas. The whole roof was blown away and we had to abandon that house. I do not need to recall the names of other typhoons that hit the Philippines on Decembers, Januarys and Februarys. That means the cool dry season described by Wikipedia is too often visited by not only rain but strong typhoons. Perhaps, because of my later advocacy against poverty, I had personally participated in relief and rehabilitation work when typhoons hit from December to February (mostly in the Visayas and Mindanao).

In historical warfare, terrain and weather are the most critical factors. They are matters of life and death that can cause victories or great defeats. But they remain critical factors in our daily lives as Filipinos as well. Between El Niño and La Niña and the pattern of typhoons, earthquakes, and volcanic eruptions we experience, I am puzzled why our national and local governance do not give terrain and weather the importance they hold over our daily lives.

It is no surprise, then, that we go through the same consequences of disasters that are already part of our national cycle. If we do not put terrain and weather front and center in our daily and annual planning, we are going to get hurt – not the terrain and weather. And it is the poor among us, many more than the official numbers used by the government, that suffer the most.

Since this pattern has been happening since our independence from the USA, the cumulative damage to lives, property, and our way of life is shocking. More than that, it is almost criminal negligence by both national and local governments. Most actions have been reactive, ending up as band aid solutions to recurring threats. I have seen many sea walls put up over the last several decades, standing there as evidence of what appears to be more than just short-term interventions.

It is sad to say but I just have to, not as a way of putting blame on the elite, that the rulers of the country, including the government, never cared enough for the poor majority. The evidence is how we treat the victims of disaster, not just after a calamity, but thereafter as well.

Landlessness was a root problem because of this elitist consciousness in society, as though there was no recognition and appreciation of a divine plan that created a sacred relationship between man and land. For such a God-fearing people, or so claimed by many, a fundamental mandate of survival was belittled, as though the vast majority without wealth or influence can live like birds on a tree or fish in the water.

Man is a mammal, and from a scientific point of view, man is also a mammal that is part of the animal kingdom of the species Homo sapiens. In other words, man needs land and cannot exist without that land as part of his environment. He needs water and air, too, of course, but so far, it is his need for land to survive and develop as a human being that is most threatened, restricted, or denied.

The Filipino poor in my lifetime, or since operational independence in 1946, has been so undervalued that control and free use of land had been denied him. Most Filipinos were squatters, unable to get titles to land where their own ancestors had been born, lived, tilled, and died for centuries. A document overtook the value of human beings, disregarded their natural rights to their ancestral lands, because others a century or more later titled lands they never originally possessed.

As a result of modernization, when those with land titles began to find greater value as real estate rather than producers of agricultural products, millions of Filipinos were restricted or evicted from lands where they and their ancestors had lived. Displaced Filipinos had to go to seashores that stayed valueless, to upland slopes where the rich had no interest, and riverbanks and canals deemed unbuildable areas.

Then came the storms, the floods, the droughts, the earthquakes, and the volcanic eruptions. Those living along seashores and upland slopes were forced by hunger to move to urbanized areas in town centers and cities where they could beg or find menial work. Because of the terrain and the climate, plus the shortsightedness of greedy businessmen and corrupt government officials, Metro Manila and similar cities absorbed refugees from calamities and witnessed slums grow.

We pay for disregarding natural and social laws, for violating our higher cultural values and norms, succumbing to personal interests over the common good.

Yes, the Sona is over and Typhoon Carina just jolted us back to reality.",Inquirer,07/26/2024,https://opinion.inquirer.net/175458/terrain-and-weather
46,Filipinos: Designated Survivors,Jose Ma Montelibano,"According to Ping Lacson, it was just a joke, and I accepted it as a joke with a sharp point. After all, the term “designated survivor” had a specific context and meaning after it became the title of a movie. But since a legally designated survivor was the one who said it, I felt the former senator was more right than wrong.

However, the assassination attempt on Donald Trump makes me think about designated survivors again.  Our world today is a most divided and contentious one with generous slices of violence. Assassinations have been happening regularly and the more prominent make global news. Naturally, after the assassinations, the designated survivors emerge.

To put the issue of a designated survivor in the context of politics in the Philippines, one must have to imagine the assassination of the President. But to be more faithful to the movie which popularized the term “designated survivor”, assassinations would not only include the President but those who are identified by law as the next in line. That puts the coming SONA at the top of mind of conspiracy theorists because those next in line to the presidency are expected to be there.

Except the Vice-President, of course, who made the joke that she appointed herself as designated survivor when she said that she will not attend the SONA. If it were not a joke, it would be sinister, almost a criminal threat.

But it is not my intention to talk about designated survivors who are mandated to be such by law, like vice-presidents when presidents are eliminated. Aside from it being a joke, even a bad one in the minds of many, it is a serious distraction to the fate and misery of many Filipinos who are looking for relief. I would rather start a private or public reflection about the way life had arranged for dire circumstances to see heroism from survivors of personal or collective tragedy.

And because a woman brought up the subject of designated survivor, I have brought back to active memory the many women in our history who were caught in dire, often violent, circumstances and saw their husbands and communities become victims of enemies with superior strength and resources. Let me cite a few.

Gabriela Silang. Teresa Magbanua. Melchora Aquino. Heneral Agueda Kahabangan. Trinidad Tecson. These names stand out. But the list is long and full of noble and brave women who went through sacrifice after sacrifice, not for their own glory or position, but for the collective good of women or the Filipino people.

Who can forget Corazon Aquino, the most famous contemporary hero of a designated survivor – from the humble housewife whose family had to suffer the imprisonment of her husband, then his assassination, to restorer of democracy and survivor of coup de états?

What about Pura Villanueva Kalaw who fought historical odds and succeeded in a man’s world, contributing substantially to making it possible for Filipino women to vote?  She survived prejudice and proved her worth over decades of achievements.

Do we remember Maria Orosa who was a celebrated war hero but survived? And then, created a revolution in Filipino cuisine with over 700 recipes?

In 2011, a COA auditor by the name of Heidi Mendoza found the courage to reveal the corruption in the military, and despite death threats, finished her testimony in Congressional hearings. Risking all, Heidi survived but the corruption ring was dismantled. She became the head of COA and moved on to become the Undersecretary General for the UN’s Office of Internal Oversight.

Of course, Maria Ressa comes to mind. After all, the kitchen sink was thrown at her, including the courts. She survived, won the Nobel Peace Award, and continues to be a voice for freedom of expression.

Leila de Lima is a survivor as well. Imprisoned on charges that all were dismissed after the Duterte administration, Leila is saying that those responsible for her unjust imprisonment must be made accountable. Let us wish her luck on her mission of justice.

Lately, I have been pleasantly surprised with former Finance Undersecretary Cielo Magno, terminated for her unsolicited advice about economic principles. Knowing the extreme probability that she would lose her job, she still made public her stand about a flawed presidential decision on controlling rice prices. She preferred to just be a regular professor of economics and lose a good-paying job as a high government official.

Professor Cielo has survived that first salvo against the power of higher authority. She has not stopped at her advocacy for transparency and accountability, albeit doing it mostly on social media and gatherings where she is the resource speaker. But she is also a member of the Open Government Partnership and will, in fact, be co-Chair with that international body at the end of the year.

The Open Government Partnership is a multilateral initiative aimed at securing commitments from national and sub-national governments to promote open government, combat corruption, and improve governance. The OGP is managed by a steering committee that includes representatives from both government and civil society organizations. The Philippines is a founding member of the OGP.   

We, too, citizens of our republic, have been the designated survivors of all the ills and mistakes of our officials. When they leave office, we are left holding the bag of consequences. The examples of the brave and determined women above and many more I could not name must inspire us to not just survive, not just make the most of it, but to be responsible for bringing our nation and future to new heights. That means if corruption and poverty are the monsters we face, we must confront, battle, and defeat them.

We have survived the filth, the stupidity, the greed, the violence, of those who lead us and end up being wolves in sheep’s clothing. The people are always survivors of our nation, and we must honor the privilege of accepting that great responsibility. Not as victims, but as designated survivors with a mission.",Inquirer,07/19/2024,https://opinion.inquirer.net/175270/filipinos-designated-survivors
47,Beyond my lifetime,Jose Ma Montelibano,"We are going around in circles. Unfortunately, the circles are spirals, and they are going downwards. I cannot say what lies at the bottom.

I have never been to war like my parent generation, those who lived through World War I and World War II. Luckily, too, I have been spared the worst like those caught in conflict areas where government troops were at war with communist rebels or Muslim insurrectionists. So, I really cannot say how bad things can go at the bottom of the spiral.

At my age, too, while the possibility is there, the odds that I will experience World War III are very slim. Our growing conflict with China is more delicate. If what self-claimed pundits are saying that we are in a proxy war between China and the United States is true, then a nuclear confrontation between the two remains slim as well. The two know it will be the end of their worlds as they know it now.

Beyond our shores, however, there is turbulence that can erupt into pocket wars. If I list down all countries with internal or regional armed conflicts, it will take up too much space. And we are mostly in the know because of the speed and volume of international news available locally – if we are interested. It is enough that we know there are enough trigger points that can light a global fuse leading to World War III. We have less problems in the Philippines in terms of the variety of issues. Almost all our different challenges stem from two major roots – corruption and poverty. Between the two, corruption is the cancer that is metastasizing while poverty is its most visible consequence. Poverty, though, is not only a result; it also plays an active role in deepening and spreading the cancer of corruption.

Because of corruption and poverty, Filipinos are grappling with new cancer growths everywhere as is the case when cancer metastasizes. It used to be that corruption was only in the hands of the Executive Branch, mostly confined to government projects that would favor cronies and demand kickbacks. In other words, they were specific and few. Today, corruption is everywhere and, as a result, is now generally tolerated.

And there lies the most painful and sinister wound – the gradual shift of the very meanings of right and wrong. Our value system, our very soul, must now undergo the perversion of accepting what is wrong and slowly letting go of the strict adherence to what we once regarded as right.

Again, because of my age, notwithstanding my active objections to this lowering or debasing of virtues and principles, I see no hope to see its reversal in my lifetime. However, I see it worsening. It is like a monster set free from its cage and hungry to devour everything and everyone that kept it there. Prayers or hypocritical lip service cannot stop the cancer of corruption. Only a purging can, when it comes.

Going against the odds, however, is not new to me. I would prefer not to. It is always easier to ride the tide for as long as by doing so, I do not create an unbearable inner conflict within my set of beliefs. When I lose hope for myself, it is only in accepting that I may not see in my lifetime the irreversible beginning of meaningful change. Woe to the virtues and values on which our ancestors built the character of the Filipino.

However, I am sure as there is day after night that the moment and process will come. Man cannot defy the natural or divine order without consequence. It is just that my sense of time is not the same as life’s sense of time – like in the popular saying “in God’s time.” Time is not mine and I must let it go. My life and actions, though, are mine and I will pursue what I believe in.

How, then, can I proceed in a mission, the favorable ending of which I do not think I can see? With so little time and resources, I have to move forward like a sniper and let go of the shotgun approach. There is no problem with my motivation. Having long dreamed about an ideal country, it was necessary for me to think of decades, not just years. Despite that, and knowing change comes slowly, I remained motivated.

The cancer of corruption has spread from one place to another, and there is no sure medicine to stop the metastasizing. To save what is left, what comes to my mind is to focus on the healthy cells and organs. They have remained healthy in a very unhealthy environment because of one fact – their immune system. A strong immune system is the first order of the day for me. Its strength must be enhanced to keep resisting the spreading cancer.

I have two target audiences that I can continue to target in my advocacy work. From 1983 in the hills of Quezon to semi-retirement today, I have focused on community development work, the last 22 years as part of Gawad Kalinga. My sanity has been sustained by this work and by a mission that calls for zero poverty, zero carbon, and zero exclusion. This work has kept me beside much younger workers from whom I continue to receive inspiration.

Community development work, however, naturally flows to nation building, a faith and patriotism partnership for me. Thankfully, it is just as true for Gawad Kalinga, its many partners, and armies of volunteers I have engaged with.

Nation building, however, touches on governance. In fact, any work addressing poverty ultimately brings one to governance simply because of the huge numbers and resources involved.

My other audience must be the idealism of mostly younger Filipinos who are the true hope of a brighter tomorrow. I pray that I can encourage them to stay the course.

The poor and the young. So be it.",Inquirer,07/12/2024,https://opinion.inquirer.net/175103/beyond-my-lifetime
