index,title,author,text,publisher,datepublished,link
1,The Marcoses' three-body problem,John Nery,"The success of the Marcos-Duterte electoral alliance in 2022 was so massive it could be said that the political equivalent of Newton’s law of inertia applied to it. A body moving at constant speed in a straight line will continue moving at constant speed in a straight line unless a force acted upon it. The alliance – if all went well, if the different parts moved at the same speed and kept to the same line – had a lock on the 2028 presidential election, which in our part of the universe determines other political possibilities. And then a force acted upon it. Now the alliance has descended into a war of the dynasties, between the Marcoses and the Dutertes, and an opening is starting to form, not necessarily for the political opposition but perhaps for a political third force led by someone like the populist, and popular, Senator Raffy Tulfo.But the reality of politics has always been messy; perhaps Newton’s laws of motion cannot really explain it. For some analysts, the break between the Marcoses and the Dutertes was inevitable; inertia was never an explanation. But some politicians believed in the alliance, and continue to do so even in the middle of the dynastic war; the law of action and reaction governs their pragmatic attempts to end it. Another way to look at the political situation today, to understand the “chaos” affecting the political class, is to borrow the theory at the heart of the popular Netflix series, 3-Body Problem, based on Cixin Liu’s The Three-Body Problem trilogy. What is the three-body problem? The character Wang Miao explains: “It’s actually pretty simple. The reason why the sun’s motion seems patternless is because our world has three suns. Under the influence of their mutually perturbing gravitational attraction, their movements are unpredictable – the three-body problem. When our planet revolves around one of the suns in a stable orbit, that’s a Stable Era. When one or more of the other suns move within a certain distance, their gravitational pull will snatch the planet away from the sun it’s orbiting, causing it to wander unstably through the gravitational fields of the three suns. That’s a Chaotic Era. After an uncertain amount of time, our planet is once again pulled into a temporary orbit and another Stable Era begins. This is a football game at the scale of the universe. The players are the three suns, and our planet is the football.” (This excerpt is of course from the Ken Liu translation.) The three suns in the second Marcos administration are President Marcos, his older sister Senator Imee Marcos, and his cousin Speaker Martin Romualdez. We can measure their gravitational pull on the planet of Philippine politics according to three factors: the scale of rehabilitation of the Marcos legacy and name, the question of presidential succession, and the choice of primary geopolitical partner. There must be other criteria, but I suggest that these three form the core. These describe their hold on their moons, account for the difference in their orbits – and explain why the Stable Era promised by the UniTeam’s unprecedented victory has deteriorated into a Chaotic Era. Marcos legacy. I think that President Marcos understands his election in 2022 as a completion of the task his family imposed on him since at least 1995, the first time he ran for national office; he has rehabilitated the Marcos name simply by winning the office his father held for 20 years. His election created the minimum condition of rehabilitation – that the public regard his father no longer as a dictator but as “just another” president, the first Marcos – and I think he is happy to claim the win. Senator Marcos’s definition of rehabilitation is much broader. She wants public opinion to reflect how she thinks of her father, as a great man wronged by history. She wants to restore her father to an imagined gallery of greatness, and this requires nothing less than a repudiation of the Edsa People Power uprising. (On rereading, I see that my July 2022 column “The four REs of the Marcos restoration” actually tracks Imee’s position more closely than her brother’s.) For Imee, it is not enough for the first Marcos to be seen as just another president. Speaker Romualdez’s idea of rehabilitation is just as expansive, but in a different direction. He expects it to cover not only the Marcoses but the Romualdezes too. For him, the true measure of rehabilitation is if another member of their extended family succeeds his cousin. His reading has disturbed others in the political class, even those who warmly welcomed the return of the Marcoses to Malacañang, because it unnecessarily tests the boundaries of political power. One may be willing to concede power to a family for six years, but 12? Presidential Succession. Marcos continues to keep his personal relationship with his vice president warm, even in the face of outright hostility and insolent language from his predecessor the former president and the two Duterte sons. I think he is pragmatic enough to accept a Duterte as a successor, if that is the way his political interests lie; at the same time, he cannot but be open to a Romualdez or a Tulfo, for the same reason. But it seems clear that his influential wife’s counsel is what he will keep. This sub-factor is a particular sticking point with other members of the political class, especially the Dutertes. Imee Marcos was one of Rodrigo Duterte’s original supporters in his long-shot campaign for the presidency in 2016, and was instrumental in convincing Duterte’s more popular daughter Sara to run as Bongbong Marcos’s running mate in 2022. As I see it, she wants her family to honor the explicit or implied agreement with the Dutertes that made the UniTeam tandem possible in the first place: Support Sara for president in 2028. While her definition of political rehabilitation is maximalist, her understanding of the dynamic of presidential elections is much more pragmatic. She sees Sara as still the candidate to beat in 2028 AND also the president who can consolidate the gains of the Marcoses best. From all indications, Speaker Romualdez wants to become the next president. He may still run for a third term as representative of the 1st District of Leyte next year, but his long-term strategy may likely involve a Senate run in 2025. A strong showing would place him in strong contention for 2028. (See Gloria Arroyo in 1995, or Grace Poe in 2013.) The ongoing campaign to raise his profile in different congressional districts is an expensive signal; to give only one example, the constituency-serving facility set up on Kamuning Street in Quezon City, while ostensibly an alliance between the district representative and his wife Yedda Romualdez’s Tingog party-list group, features only one larger-than-life image: his. Superpower Ally. Before Marcos came to power, I thought he would continue moving in the direction set by President Duterte’s pivot to China; his family’s historical ties with Chinese leadership weighed heavily in my estimate. Instead, he has firmly redirected Philippine foreign policy back to Washington DC and the Western alliance. This must stem in part from the recognition that there is an international aspect to the project of rehabilitation; in his view, the course of cleaning up the family name runs through key Western capitals. Senator Marcos would favor a return to the Duterte China-first policy. The language she used in presenting her seven-point plan in September 2022 as Senate foreign affairs committee chair speaks of “engagement” with Beijing, but her remarks since then suggest collaboration rather than engagement, to the extent that today she is seen as the principal non-Duterte defender of China. (She resents this perception.) Romualdez has controversially accompanied the President on many of his foreign travels, in part to assert his idea of “legislative diplomacy” and his ideal of Congress as a full partner of the Executive in foreign policy. But he shares the pro-Western view of his cousin, Ambassador to the United States Babe Romualdez; donated $2 million to fund a Tagalog course in Harvard University; has consistently supported the strengthening of Philippine-American ties. As president, he would likely deepen the Philippine partnership with the United States. Chaotic era. In the last two years, the three suns have each increased in mass. Romualdez’s Lakas-CMD is now the largest single party in Congress, and he has proved that he can make Congress jump through hoops. Imee has reinforced her ties with the Dutertes, who have been welcoming former allies (such as former Speaker Pantaleon Alvarez) back into the fold; at the same time, she has leaned into her role as a dependable source, “good copy,” for the media. The President remains buoyed both by constant travel and the warm welcome of Western allies; the scope of influence of his wife Lisa Araneta Marcos has also widened. As a result, their “mutually perturbing gravitational attraction ” has also grown. The turmoil within the ruling coalition includes many celestial anomalies: a stealthy two-pronged campaign to change the Constitution; open conflict between the Senate and the House; a tightening of the net around key Duterte allies; the suddenly more substantial shadow of the International Criminal Court looming from The Hague; even more aggressive interventions by Beijing in the West Philippine Sea; ever closer ties with Washington, Tokyo, Canberra, London. All this instability can be explained simply. There are three competing centers of gravity within the extended Marcos family.",Rappler,4/1/2024,https://www.rappler.com/voices/thought-leaders/newsstand-marcos-administration-three-body-problem/
2,State of the opposition: Worth dying for,John Nery,"The war on Ninoy Aquino’s legacy is a fight the political opposition should welcome, and win. It wasn’t a surprise, but for many who recognize Ninoy Aquino’s heroism, the orchestrated attacks on his legacy on the anniversary of his assassination, subverting the very meaning of his martyrdom, still came as a shock. Maybe it was the brazenness of the deceitful counterclaims, or maybe it was the sheer scale of the networked campaign, or maybe it was the sinking sense that a new nightmare in disinformation and historical denialism had begun – but the blow that shocked many into a defensive crouch was visceral, real. Can all of that history really be denied? The fact that he was killed by Marcos’s soldiers, the fact that millions of people turned out for his funeral, the fact that his sacrifice galvanized the opposition, the fact that his death in 1983 led to the end of the Marcos regime in 1986: Can all of that be deliberately forgotten, or reinterpreted, or hashtagged away? Marcos and Duterte allies are certainly trying. The groundwork had been laid during the Duterte years, when legislation to change the name of the Ninoy Aquino International Airport, the country’s main gateway, was first filed. Alarms over the possible removal of the image of Aquino on the P500 bill (part of the design since 1987) and that of his wife, the late president Cory Aquino (included in the design in 2010), were also first raised under the Duterte administration, when the Bangko Sentral initiated a new currency series that replaced heroes with Philippine flora and fauna. But the anti-Ninoy campaign grew in volume and viciousness after Ferdinand Marcos Jr. won the presidency. One of the first bills filed in the 19th Congress sought the renaming of the airport from Aquino to the man with final responsibility for his assassination, the dictator Ferdinand Marcos himself, on the mistaken assumption that Marcos built the airport. A day before the 39th anniversary of the assassination, a handful of police accounts on social media used the hashtags #NinoyNotHero (sic) and #NinoyNPA in bizarre posts that were later taken down. And on the day of the anniversary, the coordinated smear campaign against Aquino erupted into full view: He was denounced as a traitor, tagged as a communist, blamed as a destabilizer or a chaos-maker. And though the August 21 anniversary (which fell on a Sunday this year) remained a national holiday, the main institutions of government kept silent. No statements were issued. In his first State of the Nation Address the previous month, President Marcos Jr. deliberately avoided mentioning Aquino’s name; he spoke of creating “more international airports to help decongest the bottleneck in the Manila Airport.” The policy of official silence on the anniversary, then, was all of a piece.To be sure, Marcos issued Proclamation No. 42 the day after Ninoy Aquino Day, listing the official holidays for 2023; both August 21 and February 25, the anniversary of the People Power revolution that drove the Marcoses from Malacañang, were still on the list. As I wrote before, I expect it will take him three years to finally drop the two holidays.  But I could be wrong. Of the factions in the ruling coalition, there is at least one that is maximalist; it seeks to rehabilitate the father AND degrade the father’s political archrival as quickly as possible. Republic Act 9256, which declared Aquino’s death anniversary a holiday, can be repealed within a matter of months. Coalition Objectives. Why the zeal to erase Ninoy Aquino from history? Most of the parties and factions that comprise the ruling coalition, with the possible exception of the marginalized Arroyo group, are invested in reinterpreting mainstream Philippine history because a national narrative that celebrates Aquino as hero is necessarily a narrative that assumes Marcos as villain. The dictator was gravely ill on the day Aquino was killed; it is very likely that while he approved his wife Imelda’s repeated attempts to warn Aquino against coming back because of the risk of assassination, he did not directly order the killing. He must have anticipated, if not the scale, then at least the kind, of consequences you reap when you turn your rival into a martyr. But Marcos did arrest Aquino when Martial Law took effect; he did imprison Aquino for seven years on made-up charges; he did allow a military court to try, and eventually, convict, a civilian defendant; he did install a dictatorship that denied Filipinos their basic freedoms; he did create the conditions that by the early 1980s had pushed the country to the brink of social upheaval; he did manufacture a subservient military that produced the soldiers who killed Aquino. Marcos bears final responsibility for Aquino’s sprawled corpse on the airport tarmac. That that airport has borne Aquino’s name since December 1987 (through a law that was enacted without the approval of his widow, the president at that time) is a continuing reminder of that ultimate responsibility. That is why President Marcos Jr. couldn’t even say the airport’s full name; his father and his family are implicated every time the name is invoked. The Marcoses have apparently forgiven the late president Fidel Ramos for his crucial role in their ouster; they have not only forgiven their father’s defense secretary, Juan Ponce Enrile, for defecting from the Marcos regime, they have welcomed him into the official family as chief presidential legal counsel. The truth is that many of those who made the EDSA revolution happen have found ways to work with the Marcoses when they returned to political office. In that sense, EDSA as historical event is easier for the Marcos family to live with, or live down. But the Aquinos are a different matter. Ninoy Aquino and his ragtag Lakas ng Bayan party had humiliated Imelda Marcos during the 1978 Interim Batasang Pambansa elections. Aquino had repeatedly rejected Imelda’s many warnings about not coming home. He could have stayed in comfortable exile in the United States, but decided (exactly like Jose Rizal) to return home to almost certain death. That decision led to the collapse of the Marcos regime, and cemented Marcos’ historical reputation, not as the enlightened strongman he believed he was, but as the brutal dictator the assassination revealed him to be. To rehabilitate Marcos’s name and legacy, Aquino’s role in history must be degraded and denied. Opposition Opportunity. It is instructive to remember that when rumors of Aquino’s impending return circulated in 1983, the Marcos-controlled press (in an amazing display of editorial synchronicity) began printing unflattering, previously published stories about the opposition leader. Aquino before his arrest in 1972 was an easy target: rich, glib, flashy young man on the make, surrounded by bodyguards. The stories showed a man of great privilege and even greater ambition. The current campaign against him draws on this portrait – and then adds a layer of outright fabrication. The new script includes old allegations: that he was a communist (or even a founder of the Communist Party of the Philippines); that his absence during the Plaza Miranda bombing of 1971, which was aimed at his fellow Liberal Party members, proved that he was behind the act of terrorism; that he had been naturalized as a Malaysian citizen, and so on. But like Rizal, we remember Aquino because of the last 10 years of his life: seven years in prison and three years in exile changed him, we might even say purified him, and prepared him to be, in the final moment of his life, a hero. I was at that massive funeral for Aquino on August 31, 1983 – 10 years ago on Wednesday. I was one of maybe two million, maybe even three million, who escorted him to his grave. It was the largest funeral in Philippine history, and one of the largest in the world. I was also at EDSA in February 1986, when as many as four million Filipinos thronged the streets. And I was one of the 16.6 million who voted for the 1987 Constitution: an astonishing 77% of all votes cast. I believed then, and I believe now, that all those millions saw Aquino’s sacrifice as a martyrdom, and Aquino as a hero. The bracing thing: Lots of proof exist that Filipinos see Aquino as a hero. Many of the millions who turned out for his funeral or flocked to EDSA and other urban centers elsewhere in the country are still alive; many archives are accessible and easy to use. In other words, the question whether Aquino is a hero, which Marcos and Duterte allies have seeded, is actually a contest that the political opposition should join willingly, because it is winnable. In its present state, the opposition is defensive by default. The war to define Aquino’s heroic legacy, centered on the principle that the Filipino is worth dying for, is an opportunity to go on the offense, to convert hearts and minds, to speak truth with power.

",Rappler,8/30/2022,https://www.rappler.com/voices/thought-leaders/newsstand-state-opposition-worth-dying-for/
3,Elon Musk and magical thinking,John Nery,"One of many lessons from the ongoing Twitter fiasco: Billionaires make up, and bankers believe, all kinds of bullshit. To buy Twitter, Elon Musk had to pay not only the $44-billion acquisition price but also what are called closing costs. The total amount was substantially higher: $46.5 billion. A consortium of major banks, including Morgan Stanley, Barclays, and Bank of America, provided Musk with almost $13 billion in debt financing. In other words, aside from putting up his own money (largely by selling Tesla stock) and convincing investment funds to take a stake, Musk had to take out a loan. At around the time the acquisition was completed, at the end of October, the banks were already looking at a potential loss of half a billion dollars if they had sold their debt then. Now, according to a Reuters report based on a Financial Times story, the banks are looking to hold on to their debt (that is, not sell them off), having “conceded they will be stuck holding the debt on their books for months or even longer and will probably end up incurring huge losses on the financing package.” Question: How was it possible that ostensibly responsible bankers approved a multi-billion-dollar loan that started losing value the moment the loan was cleared? For ordinary people like you and me, these sums are unreal. Is there any difference between $1 billion and $13 billion, or $44 billion, for the proverbial man or woman on the street? But we presume that bankers (and investors, venture capitalists, entrepreneurs) appreciate the true weight of money. Why then did these bankers back a businessman who did not in fact want to proceed with the acquisition and had to be forced by litigation to complete the purchase? Magical thinking. The answer must lie in a form of collective magical thinking: These bankers and investors believed in Musk, despite the lack of substance in and even the absurdity of his plans for improving Twitter’s business prospects. Last May, the New York Times obtained a copy of the presentation slides – the pitch deck – that Musk used to court investor support for buying Twitter. He projected that from a base of around 7,500 employees, the Twitter workforce would grow to 9,225 this year and to 11,072 in 2025. And yet one of the first things Musk did when he took over Twitter was to fire half of the staff. Over 1,200 more employees resigned after he set a deadline. How can Musk possibly make good on his other grandiose plans for Twitter? He has less than a third of the work force he said needed to be in place by this year. And it’s not as if Musk’s drastic moves were a surprise. His track record at Tesla, the electric-vehicle manufacturer, and at SpaceX, the rocket business, should have warned  bankers and investors that self-created chaos was his playbook. Musk “clearly thrives in existential circumstances,” a former Tesla engineer told the Times. Musk told investors that by 2028 he would grow Twitter’s user base from 217 million in 2021 to 931 million; transform the platform’s payments business from a projected and paltry $15 million in 2023 to about $1.3 billion; and raise company revenue from $5 billion in 2021 to $26.4 billion. These numbers are literally incredible: hard to believe, or even credit. This is the business bullshit that the bankers bought? This is the BS that magical thinking sold. Never mind the Qatari or Saudi investors, who may only need to answer to their sovereigns, but what about the suits in Morgan Stanley, who agreed to loan Musk about $3.5 billion? Do they still have a job? Market mentality. I suppose the answer here is the other side of Musk’s track record; bankers and investors can point to his success at Tesla and at SpaceX. But the free market these capitalists supposedly believe in has in fact been driving down the value of Tesla for a year already. Just last Monday, Bloomberg reported that Musk’s net worth shrank by $8.6 billion. He lost more wealth in one day than the entire fortune of the single richest person in the Philippines, Manny Villar. In the first 11 months of the year, Musk’s net worth fell by an astonishing $100.5 billion – equivalent to about one-fourth of the Philippine GNP. The scale is staggering in itself, but the losses are something else. The cause is clear enough. Fortune magazine noted that since November 2021, when Musk’s wealth was at its peak, “Tesla’s stock has fallen more than 59% as growing recession fears, slowing EV demand, and Musk’s Twitter acquisition have weighed on investors’ confidence.” Tesla is the main source of Musk’s wealth. Aside from internal problems (the most recent recall involved 300,000 cars with a factory defect) and economic difficulties (more expensive raw material, more restrictive China market), Tesla also has to contend with Musk’s new acquisition, Twitter. Some investors “worry that Tesla’s strategy may fall to the wayside” (Fortune); other investors fear that “the billionaire is spreading himself too thin” (Bloomberg). But the real problem is that, in late capitalism, billionaires can lay it on too thick—and bankers, investors, venture capitalists are only too willing, too gullible, to believe them. ",Rappler,11/25/2022,https://www.rappler.com/voices/thought-leaders/newsstand-elon-musk-and-magical-thinking/
