index,title,author,text,publisher,datepublished,link
26,[OPINION] Help define how our democracy will survive,Maria A. Ressa,"Even as we see what's being destroyed around us, remember: we are creating the future now,' says Rappler CEO Maria Ressa in a speech at the Ateneo School of Medicine and Public Health Commencement Ceremonies
Rappler CEO Maria Ressa addressed the Ateneo School of Medicine and Public Health’s Class of 2019 on Sunday, August 11, urging them to build their identity, profession, and the nation’s democracy by embracing their values, their fears, and their journey. 

A total of 148 graduates received their dual MD/Master of Business Administration degrees. 

“You will help define what our society will look like and how our democracy will survive and evolve,” she told the graduates at the Meralco Theater. “This is a time of creative destruction. Even as we see what’s being destroyed around us, remember: we are creating the future now,” she said.

Below is the full text of her speech.

Congratulations, Class of 2019!

You’re graduating at an existential moment in history. 

When global power structures are turned upside down by technology, triggering an erosion of all our rights.

When journalists around the world are under attack, democracy is under attack. 

I know this firsthand: in 14 months, the Philippine government filed at least 11 cases and investigations. I was arrested twice in a 5-week period early this year, and I’ve posted bail 8 times in about 3 months. In order to travel, I have to post more than P500,000 in bonds. 

Journalism is not a crime. 

Yet, I’ve seen social media and our legal system weaponized against us – and any other perceived critics of government. 

We hold the line. Because we live our mission. Because – as Time Magazine wrote – we are the Guardians of Truth.

This battle for truth is the battle of our generation.  

Now more than ever, we know that information is power. Without the right information, it’s impossible to fight back – whether it’s to find a cure for a disease or to hold power to account.

We need to fight the insidious manipulation social media technology platforms have allowed: where lies laced with anger and hate spread faster than facts.  

These lies are like a virus that has infected our information ecosystem, playing to the worst of human nature, turning us against each other. They replicate and cripple our body politique – spreading a disease that still has no cure.  

A lie told a million times becomes a fact. Without facts, we don’t have truth. Without truth, there is no trust.  

This is why democracy is broken, not just in the Philippines but around the world. 

I’d like to share 3 lessons with you as you go into battle for your identity, your profession, our democracy. 

Embrace your values because with that comes your humanity.
Embrace your fears.
Embrace your journey.  
Embrace your values 

Remember why you chose to become a doctor. 

You chose a specialized degree that has an embedded mission for a broken society. Seven out of 10 Filipinos die without ever seeing a doctor, and the statistics promise you no sleep — like: only 3 public doctors for every 100,000 people.

To those who chose business, how are you going to fight corruption? 

Life is all about making choices. That’s what we do every minute of the day. 

These little choices define who you are, and if you’re not clear about your values, you may wake up when you’re older and realize you don’t like the person you’ve become. 

Every choice defines who you are, and they could be really simple like choosing to turn right instead of left – they lead to different paths. Or accepting a bribe because in your mind you’ve rationalized it as a gift.  

Character is created in the sum of all these little choices we make.  

Now, while you’re sitting there before going into battle, choose the values that define you. Do it now. Because when you’re tested – and it will come if it hasn’t already – you have to know the lines you’ve set. 

Draw the line: on this side you’re good; on this side you’re evil.  

This is what prevents situational ethics. This makes sure you can’t rationalize bad behavior. 

You don’t really know who you are until you’re forced to defend it. Then every battle you win, or lose, every compromise you choose to make…or to walk away from – all these struggles define the values you live by and, ultimately, who you are. 

Then when you’re in battle, avoid the hate: the US against THEM, rich vs poor, dilawan vs DDS – these labels are meant to divide us. Populism is easy. Real leadership is not.  

Find what we all have in common. That’s our humanity. 

Alone we accomplish very little – no matter how bright or talented you are. It’s about what we can do together, to find what binds us together. 

We build a stronger democracy by strengthening our common humanity.  Embrace your fears 

I’ve been asked a lot in the past year: are you afraid? Of course, I’ve had those moments! But CNN trained me to be a conflict reporter, a war zone correspondent. I plan the way in and chart the way out of any field of battle. 

What I’ve learned is that fear spreads and is debilitating. Fear is a luxury.  

If you’re in the middle of chaos, you need to stamp down your fear to have clarity of thought – that’s essential to make the right decision. The way to do that is the 7Ps: “Proper preparation prevents poor performance.”

So I go back to what I learned in school. Fear is your worst enemy. It stops you from doing what you want.  

Whatever you’re most afraid of, touch it. Hold it. Embrace it. Because once you do that, nothing can stop you.  

In my case, dealing with the fear really started last December. That was when Time Magazine named me person of the year – one of the guardians of truth – and I realized I was the only one among us who was then both alive and free. That was the seed. 

Then last April at the launch of the Clooney Foundation’s Trial Watch, for some reason, it became real. I realized I could go to jail – 63 years, in fact, as Amal Clooney pointed out. I was on a panel: Mohamed Fahmy, who was jailed in Egypt for 438 days, was to my right. Jason Rezaian, who was jailed in Iran for 544 days.  

I talked to them. I read their books. Could I endure what they went through? 

What is the worst case scenario I could imagine.  

Then I embraced it. And robbed it of its power.

Prepare for the worst, and hope for the best. 

Embrace your journey

The founders of Rappler – 4 of us, women in our 50s now – well, we joke that we jumped off the cliff. In the Philippines, we’re the only news group whose business is created and controlled by journalists. That’s what we mean by independence. 

So it’s not a surprise that we would continue doing the story, even if – and especially if – it’s bad for business. Yet, despite that, we found a new business model that has our revenues up significantly since last year. We’ll take the risk to do the stories that matter.

The first casualty in our country’s war for truth is exactly how many people have died in our brutal drug war. The police admit they killed more than 6,000 people – rolled back by PDEA right before SONA to 5,600. But human rights groups and the UN estimate that at least 27,000 people were killed from July 2016 until December last year.  

Our impunity series looks at the lives behind these numbers. We fight impunity on two fronts: the Philippine government in extrajudicial killings and the exponential lies on social media – Facebook, which is essentially our internet. 

Facebook is the world’s largest distributor of news, but it ignored the responsibility that comes with that – the gatekeeping powers of journalism, that determines the quality of our democracies around the world. 

I don’t know where any of this will end. Like I said, we jumped off the cliff by standing up for our values, by upholding the mission of journalism, and holding the powerful to account. 

Facebook is our frenemy: Rappler is one of its 3 fact-checking partners in the Philippines, but finding the lies is a game of whack-a-mole. What’s more important is to find the networks of disinformation that spread the lies – and in that you see how all this is connected to geopolitical power play. In our digital forensics, we’ve shown links to the alt-right in Canada, to the alt-right in the US, to Europe, and to Russian disinformation. 

Embrace your journey. And don’t forget to have fun. 

I am daily inspired by our team in Rappler, their spirit, their sense of mission. Despite the threats we face, we are living our ideals now. This is our reality.

What you do today matters.  

You will help define what our society will look like and how our democracy will survive and evolve.  

This is a time of creative destruction. Even as we see what’s being destroyed around us, remember: we are creating the future now.  

Let’s make sure it’s the future we want.  

Get ready for battle. Embrace your values and your humanity. Embrace your fears and embrace the journey. Class of 2019, our hopes are with you. It’s going to be tough but I know you will change the world for the better.",Rappler,08/19/2019,https://www.rappler.com/voices/thought-leaders/237856-full-text-maria-ressa-commencement-speech-ateneo-school-public-health-medicine-august-2019/
27,#CourageON: Defending our rights,Maria A. Ressa,"It’s time to ask yourself a question we’ve lived with for years now: What are you willing to sacrifice for the truth?
Silence is complicity. 

The blatant abuses of power are now codified into law. It happened in June: a regional trial court’s order changing the period of prescription for libel from 1 year to 12 years; the shutdown of ABS-CBN; and the quick passage of the Anti-Terror Law, under which a critical voice can be named a terrorist, arrested without a warrant, and jailed for up to 24 days. 

The walls are closing in. 

The Philippines is at the precipice. There’s no need to declare martial law because the very processes of democracy have been turned against it. We now live in a time that is “worse than martial law.”

It’s democracy’s death by a thousand cuts. 

The way we at Rappler have survived 4 years of attacks is by: 

1. Shining the light: Name it and demand signatures to these abuses. If we can’t get justice now, we will later. History is on our side. 

2. More hard-hitting journalism: Continue to hold the powerful to account and demand accountability for the people. Of course, the more we do that, the more the full power of the State is turned against us.

3. More innovation: We continue to explore and to build at a time of creative destruction. The Lighthouse, rolling out this week, is our latest experiment and  provides a beacon to safer shores. (Read: How Lighthouse gave us hope)

Hatred, arrogance, and incompetence can only affect you if you let it. The battle begins in our minds. (Read: Rappler ends 2019 with income: A comeback year) 

While I hate being the government’s cautionary tale, I’m not afraid. It made me stronger, solidified the values I believe in, made me draw the line I cannot cross. I will defend the mission of journalism as long as we are a democracy because press freedom is the foundation of every right of every Filipino under our Constitution. My job is to hold up the sky so our journalists can do their work. 

It’s time to ask yourself a question we’ve lived with for years now: What are you willing to sacrifice for the truth? I am at peace with my answer.

Everyone who speaks comes under attack on social media, once an enabler, now a tool for oppression. Be prepared for it. Accept this will happen. Social media is now a behavioral modification system. 

We’re demanding accountability as well from the social media platforms, but Lighthouse is also an experiment to see how tech can serve journalism and democracy. Please test it and give us your feedback. 

We can’t do this alone. The impunity of power is brazen, and the battle has now come to every Filipino. (Read: ABS-CBN’s battle is also ours)

We’re not alone. What’s happening in the Philippines is happening globally. In 2018, I laid out 6 action points for the international community. 

Many of you know I spent nearly two decades working outside the Philippines (and recently had a chance to celebrate #CNN40 with my former colleagues). After the June 15 conviction on cyber libel, 60 press freedom organizations around the world came together to help independent media survive in our country. Please consider signing this petition to help me stay out of jail. #JournalismIsNotACrime

When facts are under attack, journalism is activism. Help us #HoldTheLine for our rights. 

Use it or lose it. 

#CourageON.",Rappler,07/16/2020,https://www.rappler.com/voices/newsletters/courageon-defending-our-rights/
28,[ANALYSIS] Technology’s tsunami,Maria A. Ressa,"Technology and the pandemic have destroyed our old world and are forcing all of us to actively create a new one. We need to act now.'
Right before America votes, I can’t help but think we are underestimating the impact of technology on our behavior. Behavioral research has long shown that we vote, not based on what we think, but on how we feel. Now imagine that in today’s information ecosystem, which uses neuroscience and predictive analytics to shape our behavior. It’s an extractive business model that allows “fake news” to flourish.

Technology upended journalism, pitting evidence-based news organizations against propaganda, hate speech, and conspiracy theories. Mocha and QAnon won; news lost. That’s what the data shows. 

For about a decade now, technology has been a tsunami, devastating and reshaping industries: music (Apple, Spotify), hotels (Airbnb), transportation (Uber, Grab), and so many more. News organizations lost their gatekeeping roles to technology. That upended the information ecosystem and the distribution of facts. It began to reshape systems of governance and change the geopolitical power balance. 

The new gatekeepers had easy confidence because they cut the world into quantifiable pieces – never mind if it isn’t true, and never mind the consequences.

Move fast, break things
Decades back, I remember asking questions the engineers couldn’t answer about the impact of their choices on society: on personalization; the lies that you can only mute or block; the unintended consequences of “friends of friends” growth.

Personalized recommendations moved from whatever you searched for (that followed you for weeks online) to personalized news feeds. The question I asked then: how can we all have our own different realities? How can news exist in a world like that? If there is no shared public reality, no shared facts, then democracy as we know it is dead.

Lies that you can only mute or block drive me crazy as a journalist. Because they stay and continue to spread: the more salacious, the faster the spread. Emotions, like anger and hate, spread faster too. That alone showed the abdication of responsibility of the new gatekeepers and how little respect they had for the public.
This played right into long-running Russian military tactics which the public saw in Crimea in 2014. Called the firehose of falsehood, Russian propaganda is meant to “entertain, confuse, and overwhelm.” Fast forward a few years, and now you have leaders of democracies, elected with the help of social media, mimicking the same tactics, like President Rodrigo Duterte or President Donald Trump.

How every social media platform uses algorithms recommending friends of friends to grow your network and their user base. Except that one seemingly minor decision, while good for growth, also built filter bubbles and divisiveness – us against them thinking – into the platforms distributing the news and consequently, into our societies.
These 3 practices and many more are part of a god’s eye-view of data, where content is neither good nor evil, and the goal of accumulating data above all feeds the business model of predictive behavioral analysis, the cornerstone of what Shoshana Zuboff calls “surveillance capitalism.”

One root cause
In her groundbreaking book, The Age of Surveillance Capitalism, this Harvard emeritus professor argues that many of the problems we’re dealing with today – the weaponization of social media, the destruction of data privacy and security, our inability to hold technology platforms to account – are all part of the same problem: the extractive business model which is insidiously manipulating us without our knowledge. 

Working with Shoshana in The Real Facebook Oversight Board, I’ve put words to my experiences, like “radical indifference” – what she calls “an asocial framework” for evaluating data because in this world, all data is equal. The key is volume, not quality. This is the core of “fake news” – strip branding from news organizations, which differentiate between fact and fiction. In this world, lies laced with anger and hate spread faster and further than boring facts. (READ: The Spread of True and False News Online)

So what do we do about this? Our solution in Rappler is 3-fold, aligned with our founding principles: 1. Demand accountability from technology; 2. Protect and grow investigative journalism; and 3. Build community and civil society. (READ: As democracy dies, we build a global future) 

Build better
This month, the Information and Democracy Forum will be releasing 4 papers from our infodemics working group that former EU Parliament member Marietje Schaake and I co-chair. We recommend policy frameworks around 4 structural challenges: the transparency of digital platforms; the meta-regulation of content moderation; the platform design and reliability of content; and mixed private and public spaces on closed messaging services. 

We see this as a jump-off point for governments, technology companies, and civil society organizations to begin a much needed public discussion with academics, lawyers, and journalists. 

Technology and the pandemic have destroyed our old world and are forcing all of us to actively create a new one. Defining the problem, bringing in all who need to help solve it – these are only the first steps to make sure we create the world we want.

Regardless of who wins the US elections, we need to act now.",Rappler,11/2/2020,https://www.rappler.com/voices/thought-leaders/analysis-technology-tsunami/
