index,title,author,text,publisher,datepublished,link
10,Time to negotiate peace again with the CPP-NPA,John Nery,"The communist insurgency is at its weakest. Counter-intuitively, now is the best time for both sides to resume peace talks and reach a peace deal. A new report by the International Crisis Group published in April concludes that the “Maoist insurgency in the Philippines is at its lowest ebb in decades.” From a high of 25,000 armed regulars in the last years of the Marcos regime, the number of rebels is down to somewhere between 1,200 and 2000 – roughly speaking, close to the same number when the first President Marcos used the then-new insurgency as a pretext for imposing martial rule in 1972. The insurgency is hampered by serious organizational challenges, including “perhaps the most severe leadership crisis in its history” (provoked not only by the death of its founder but also by “the killing [by the Philippine military] of several high-ranking commanders over the last three years”); a reduction in revenues generated from so-called revolutionary taxation (because of the loss of territory and “the arrest of financial operatives”); and internal confusion (“differences among cadres regarding the movement’s political and military direction”). These and other crises can be seen reflected, even without the benefit of context, in the message the Communist Party of the Philippines published to mark its 55th anniversary. Without reference to the combination of military pressure and development outreach that the government has been leveling against the insurgency, the message may read as yet another (though still remarkably candid) exercise in the revolutionary discipline of “criticism and self-criticism.” But read in the context of the rebellion’s continuing loss of leaders, fighters, base areas, resources, and informal support structures, these passages from the December 26, 2023, message confirm that the movement is, in fact, in bad shape. The message recognized that “not a few guerrilla fronts of the [New Peoples Army] stagnated and got stuck for a long time at the old level.” The cause, however, was identified as “some Party leaders,” who “self-constricted the NPA to its reliable guerrilla base areas and mountain encampments, limiting the scope or range of military and political initiative of the Party and NPA. Self-constriction goes against the need for guerrilla units to constantly move forward and advance, and to be always on offensive footing. Reliable guerrilla base areas were eventually reduced to a few ‘favorite’ or ‘comfort zone’ barrios, communities or mountain encampments with easy access to mass support, supply lines or communication facilities.” Military conservatism. The message developed its argument with even more candor: “Self-constriction and loss of initiative leads to military conservatism, as points from which the NPA can hit the enemy became limited or inaccessible. Other concomitant problems that arise include gathering intelligence, sources of supply, communications, and so on. The NPA could not readily carry out an ambush at the highway because its main forces are encamped in the interior areas. Mounting raids, ambushes, and other basic tactical offensives became increasingly cumbersome and time-consuming. They became content with attrition tactical offensives (harassment, sanctions and so on) and lost sight of the need to mount sustained annihilation or basic tactical offensives as the principal component of our strategy to weaken the enemy part by part and steadily strengthen the people’s army. “In a significant number of guerrilla fronts which had company-sized or multiple-platoon-sized forces, some Party leaders became complacent and self-assured. There were cases of over concentration of forces in some regions or sub-regions, where two or more guerrilla companies are brought together in a mountain encampment over extended periods of several months, to conduct trainings, education courses, prolonged meetings or to await execution of an ill-planned offensive, leaving less [sic] forces and less time for mass work. These prolonged encampments caused a heavy strain on the organized masses and militia forces who have to work hard to keep the supply lines running. These also cause guerrilla discipline to slacken and ‘civilianize’ guerrilla forces. Some NPA units have encountered problems of drinking among guerrilla fighters.” And so on, in this vein. The Crisis Group report characterized the CPP as “mindful of these challenges,” and summarized the message of December 2023 (and that of March 2024 too) as a call to “galvanize the movement” and “reinvigorate political and logical education for cadres and combatants.” Peace talks. Does it make strategic sense for the Philippine government to restart peace talks with the CPP-NPA and its National Democratic Front? The joint announcement last November of an agreement to resume peace negotiations was a real surprise – and was met with a mix of skepticism and hope. The skeptical response raised suspicions about political maneuvering ahead of the 2025 midterm elections; when Ferdinand Marcos Jr. ran again for the Senate in 2010, he was on the same slate as Bayan Muna’s Satur Ocampo and Gabriela’s Liza Masa. The hopeful stance recognized that one of the administration’s signatories of the Joint Statement for Peace was Special Adviser to the President Anton Lagdameo, President Marcos’ closest friend. But if the insurgency is at its weakest, why even attempt to strike a peace deal? Shouldn’t the government continue its current campaign mixing military pressure and development outreach until the last base area is recovered, the last guerrilla front overrun? It has already been about a decade since the national security establishment under the second Aquino administration came to the conclusion that the communist insurgency was no longer the country’s main national-security threat. The pivot to external defense or territorial defense operations (TDO) under the second Marcos administration formalizes the downgrading of the insurgency. Peace negotiations will help ease the pivot to external defense. That is the first reason why the Marcos administration should return to the negotiating table. The second reason is the law of diminishing returns; the counter-insurgency campaign that has helped reduce the size of the NPA by about half, since Rodrigo Duterte came to power, may have already reached its optimal phase. Besides, the kind of justification often offered by those who would like the current campaign to continue is very much along the lines of “crushing” the rebellion. The rebels are on the run, why stop hot pursuit? Because history’s lesson is clear. According to “Paths to Victory,” the 2013 RAND Corporation study of 71 insurgencies (updated from its influential 2010 study of 30 insurgencies, titled “Victory Has a Thousand Fathers”), the so-called “iron fist” path succeeds “only 32 percent of the time,” while its opposite approach, the so-called motive-focused path, succeeds 73 percent of the time. The iron fist approach to counterinsurgency (COIN) focuses primarily on “eliminating the insurgent threat,” while the motive path addresses “the motives for beginning and sustaining the insurgency.” In other words, the iron fist seeks to hammer the insurgents to oblivion, while the motive-focused approach resolves the conditions that gave rise to and supplies the insurgency. And the lesson from the history of insurgency from 1944 to 2010 is that the COIN odds do not favor the use of force alone. To quote the 2013 study: “The importance of reducing insurgents’ tangible support is the center-most finding of this research. Successful COIN forces reduce not only the active insurgents but also the support that fuels the insurgency.” But the Philippine Army, by far the largest of the services, has more invested in continuing the counterinsurgency campaign than any other institution; it is, hyperbolically, the only thing they know. They (and the Duterte political alliance) may stand in the way. Weaker position. Does it make strategic sense for the communist insurgency to enter into peace talks? As the scattered leadership must be only too aware, they will be returning to the negotiating table with a much weaker position. But they do own a conspicuous advantage: They offer the second President Marcos the historic opportunity of ending the insurgency that started under the first President Marcos. If the Marcos family were serious about rehabilitating their family name, concluding real peace with the communist rebels would rank high among the pathways to rehabilitation – not as high as paying their billion-peso tax arrears or returning their ill-gotten wealth, but high enough to cement their new reputation in Western capitals. But peace talks may also result in the suspension of red-tagging and red-baiting by government and military officials (the provocative actions of Duterte supporters is a different problem altogether), and may create the momentum necessary to review and improve the work of the task force overseeing the government’s COIN campaign. Not the abolition that UN Special Rapporteur Irene Kahn had strongly recommended (that looks outside the realm of political probability), but at least a change that renders it more community-oriented, more representative, more civilian. (The Crisis Group makes the same recommendations.) Time to talk peace again.",Rappler,05/11/2024,https://www.rappler.com/voices/thought-leaders/newsstand-negotiate-peace-again-cpp-npa/
11,Corruption and the Gen Z revolution,Iris Gonzales,"Inside Bangladesh, it’s called the Gen Z revolution as young students from Dhaka University began protesting last month to demand an end to the government’s jobs quota system.

The system, according to a CNN report on the Bangladesh crisis, reserves 30 percent of civil service posts for relatives of veterans who fought in Bangladesh’s war of independence from Pakistan in 1971.

“Many of the country’s contemporary political elite are related to that generation – including Prime Minister Sheikh Hasina, a daughter of Sheikh Mujibur Rahman, the widely regarded founder of modern Bangladesh who was assassinated in 1975.”

Following days of protests which had turned bloody, the 76-year-old Prime Minister Hasina resigned and fled the country by helicopter to India.

Hasina’s sudden exit ends 15 years in power, which were marred by dissent because her government, according to critics and human rights organizations, stifled civil liberties.

Amid joblessness, high inflation in the post-pandemic era and the growing curtailment of freedom, protestors demanded change.

Ironically, Hasina led a democratic uprising against military rule in 1990. Now she has found herself in the same situation but at the other end of the uprising.

It was a long time coming. It was not a revolution that happened overnight.

Prior to the July 1 protest, critics and human rights organizations have already expressed concerns over increased reports of political violence, harassment of the media and opposition figures, crackdown on freedom of expression online as well as arbitrary detention and torture in Bangladesh.

Tipping point
This was not the first time that protests hounded Hasina’s government even as she managed to survive previous demonstrations.

The recent protests, however, were different as police shot and killed the young dissidents in full view of their peers.

This seemed to be the tipping point. Protestors could no longer be stopped, not even by the threat of being killed by security forces.

“Driving the anger was high unemployment levels in the country, especially among young people. Bangladesh has seen strong economic growth under Hasina, but it slowed in the post-pandemic era and is beset with high inflation and depleted foreign currency reserves. In a nation of 170 million people, more than 30 million are not in work or education,” according to CNN.

This could be the first major successful Gen Z revolution in world history, said Sabrina Karim, associate professor of government at Cornell University, who specializes in the study of political violence, as quoted by CNN.

People Power I
The Philippines is no stranger to uprisings.

In 1986, we inspired the world with the historic bloodless People Power revolt which toppled Ferdinand Marcos Sr.

Whether in the Philippines or in Bangladesh, however, the challenge is how to protect the freedoms we’ve fought for and successfully won.

The challenge is to fulfill that promise of change that protests and revolutions strived to usher in.

Leaders of change must make sure that they are indeed capable of becoming the change they want to see in their country; that they wouldn’t just turn into the next monster or ogre they successfully slayed and that they wouldn’t end up being corrupted by the system they vehemently opposed and tried to change.

Otherwise, it will just be a cycle of boom and bust; of authoritarian rule and revolutions; of protests and military rule or, in our case, of yellows and reds; of Marcos and Aquinos; or of Marcos and Dutertes.

Look what happened to us. We toppled a dictator and showed the world how it was done only to elect another Marcos into power more than three decades later.

Ironically, some of those who protested against then president Marcos Sr. back then are now part of the government of President Marcos Jr.

One cannot blame them, however. Or the masses. Perhaps for them, nothing really changed after the 1986 People Power Revolution.

We are unique in this sense because it seems we never really learn our lessons. History just keeps repeating itself, no matter how absurd a cycle that is.

One culprit I see here is corruption.

Corruption has been around for thousands of years. Shakespeare’s plays showed vignettes of corruption, while Dante supposedly placed bribers in the deepest parts of Hell, according to the International Monetary Fund’s working paper on corruption published in 1998.

And yet, it doesn’t seem to end.

After a new candidate or a new system is in place, the initial jubilation soon fades as constituents realize that the same old system or the same old trapo is back.

In the Philippines, it’s even getting worse, especially in local government units where corruption has become so deeply entrenched.

Pay offs or grease money have gone up by 30 to 50 percent, attest some businessmen; some local chieftains even offer “bespoke pay-offs packages” to entrepreneurs who want to set up shop in their locality, depending on their capacity to pay and their needs.

Local chieftains, like lawmakers, also have their own contractors which they require businessmen to hire.

Anti-corruption bodies, including the Anti-Red Tape Authority, must look into these reports to eradicate corruption in the different branches of our government.

Revolutions can only lead to lasting changes if they topple not just flawed leaders but corrupt systems as well.

This is a lesson that Gen Z Bangladeshis must also keep in mind now that they have removed their leader from power.

Otherwise, it’s just going to be the same old story.",Philstar,08/08/2024,https://www.philstar.com/opinion/2024/08/08/2376254/corruption-and-gen-z-revolution
12,With a smile,Iris Gonzales,"Curtains close. Kisses stop. Love stories end.

Indeed, some things in life are fleeting and ephemeral. That’s just the way it is. There’s even an old adage that says all good things come to an end.

Once in a while, however, life surprises us with something so great that it lingers and lives on in our hearts. Forever.

Such is the music of the legendary rock band Eraserheads, the kind that resonated – and continues to resonate – with generations and generations of Filipinos. Their songs were always someone's anthem and gospel truth; inspiration or palliative; a curse even but always an impetus to move and act.

It’s no surprise therefore that on Tuesday, Aug. 20, members of the band – Marcus Adoro, Ely Buendia, Raimund Marasigan and Buddy Zabala – returned to their Alma Mater, the University of the Philippines, to receive the prestigious Gawad Oblation Award, the highest distinction that the university can bestow.

Says UP president Angelo Jimenez in his welcome remarks: “The Gawad Oblation is a symbol of our deep gratitude for that extraordinary service rendered with or in our name. In the name of UP.”

It’s no exaggeration, he adds, that the Eraserheads “are a pivotal force in the history of original Pilipino music.”

“The Eraserheads helped define the music, memories and identity of a generation, no less.”

They also humanized a generation during a very very divisive period in the history of our country by asserting individuality, president Jimenez also says.

For the band members who all studied in UP Diliman, it was a full circle moment of sorts. The university, they said, was the foundation for their voice, art and music.

In their acceptance speeches, the Eraserheads said it was in UP where they tasted and experienced real freedom. “Kalayaan pumili at maghayag, kalayaan sundin at kalayaan pakingan ang sariling himig,” said Marcus.

Raimund thanked his parents who supported him even if he didn’t get to bring home a diploma, drawing laughter from the crowd. Buddy, too, thanked those who supported the band throughout their journey.

Ely recalled how music saved him from a sure failing grade in Spanish. “Singko,” says the Eheads vocalist in an exaggerated Spanish accent, drawing more laughter from the crowd.

“I begged my professor for a passing grade. And he asked me: Do you have anything that would make me consider passing you? Anything at all?

Ely told his professor:

Well I can write a song and so I gave him a demo cassette of Pare ko and prayed.

The next day, to his pleasant surprise, his professor in Spanish told him that he passed.

This experience taught Ely two things.

“One is that my professor could understand Tagalog and that two, from that point on, that music can get me through anything in life.”

A year later in Kalayaan, Ely found three people who also had his struggles and shared his dream.

The rest, as they say, is history.

For the crowd that descended into the glittering Executive House for the Gawad Oblation awarding ceremony, it was a great honor and delight to bear witness to such a momentous occasion.

President Jimenez invited me to cover the event but there at that moment, I could barely cover. I was just taking it all in with wide-eyed awe and a full heart, listening, as a huge fan, to their story.

For how could I not? It was a band that accompanied my generation in the murky years of our lives – from teenage to adulthood, those years of first loves and first heartbreaks, first defeats and first triumphs.

But for the first time, I was not watching them perform. I was listening to their stories about their UP days.

What they said about UP being a bastion of freedom and an abode to find your voice and pursue your passion is perhaps true for every UP student and alumni.

Most Distinguished Alumnus
Days before, in a separate but equally festive awarding ceremony for the UP Alumni Association awardees, tycoon Isidro “Sid” Consunji shared a similar story as a student after he was hailed as this year’s Most Distinguished Alumnus of UP.

Sid described himself as an ordinary engineering student but highlighted the fact that he also learned a lot from the time he spent in UP – outside its classrooms.

“I spent more time outside the classroom than inside, being active in Beta Epsilon Fraternity and the Association of Civil Engineering Students,” said the DMCI Holdings chairman who led this year’s roster of distinguished awardees.

I, too, was at the UPAA event, together with my family as we received the Multigenerational Alumni Family Award given to us.

On the sidelines of the event, Sid or IAC, as he is known in the business community, asked me where I get my inspiration to write my stories. In jest, I pointed to the Macallan on his table, saying it’s my poison and inspiration.

But in reality, as I stood there at both awarding ceremonies, I was reminded of the fact that its in UP indeed where I really learned to dream and pursue the things that inspire me.

As Ely Buendia said, “UP shaped not only our minds but also our souls.”

And from the others who came before us, our professors and fellow alumni included, we found the courage to carry on.

The Eraserheads and their songs, for instance, are vivid reminders of making it from one point to the next, of surviving the hardest of times and eventually thriving with a smile.",Philstar,08/22/2024,https://www.philstar.com/opinion/2024/08/22/2379602/smile
